{"student_target_summary":"Secure midpoint/distance; consolidate signed gradients and line equations; build independent perpendicular-line reasoning.","teacher_priority_summary":["negative-coordinate gradient","equation of a straight line","perpendicular line"],"question_count":3,"estimated_minutes":25,"total_marks":12,"difficulty_profile":"retrieval into consolidation into integration","questions":[{"question_number":1,"primary_skill":"signed gradient","supporting_skills":["midpoint"],"evidence_addressed":"negative-coordinate subtraction error; midpoint secure","purpose":"diagnosis","difficulty":2,"marks":3,"expected_answer_type":"fraction and coordinate","verification_method":"gradient and midpoint recomputation"},{"question_number":2,"primary_skill":"line equation","supporting_skills":["gradient"],"evidence_addressed":"needed prompt to find gradient first","purpose":"consolidation","difficulty":3,"marks":4,"expected_answer_type":"y = mx + c","verification_method":"point substitution"},{"question_number":3,"primary_skill":"perpendicular line","supporting_skills":["negative reciprocal","line equation"],"evidence_addressed":"perpendicular gradient unstable","purpose":"integration","difficulty":4,"marks":5,"expected_answer_type":"line equation","verification_method":"gradient product and point substitution"}]}
